Title,Description
"Менеджмент","Managers increase a number of employees you can have. But each additional manager is less effective."
"Разработка","Developers generates more Development Points. And a technical debt if unchecked."
"Дизайн","Designers help to create a better looking product with better user experience (UX)."
"Управление продуктом","Product managers are crucial to make more consistent products and to maintain focus."
"Маркетинг","Marketing specialists are essential to make your product pop. They are directly responsible for Market Points "
"QA","Quality Assurance (QA) help your product to be less buggy and more reliable."
"Поддержка","Without a support specialists anytime users will discover any issues with the product they will just leave or bother developers directly."
